{
  "schemaVersion": 1,
  "id": "core-v1",
  "contentVersion": 1,
  "name": "核心牌组第一版",
  "description": "首发核心集，包含起始套牌、固定补给、状态牌及 11 张市场牌。",
  "cardIds": [
    "starter_allowance",
    "starter_quarrel",
    "starter_draft_paper",
    "starter_punctuality",
    "supply_errand_runner",
    "supply_milk_bread",
    "supply_print_materials",
    "status_pressure",
    "red_pre_match_warmup",
    "red_extra_training_plan",
    "blue_all_night_study",
    "white_duty_student",
    "white_discipline_week",
    "green_makerspace",
    "neutral_class_representative_notice",
    "white_discipline_warning",
    "white_dorm_inspection",
    "white_student_affairs_talk",
    "neutral_finals_week"
  ]
}
